code,question,option 1,option 2,option 3,option 4,correct answer
99-GSAT-5,The government is doing its best to _____ the cultures of the tribal people for fear that they may soon die out.,preserve,frustrate,hesitate,overthrow,preserve
99-GSAT-6,"I could not ______ the sweet smell from the bakery, so I walked in and bought a fresh loaf of bread.",insist,resist,obtain,contain,resist
99-GSAT-7,"Steve has several meetings to attend every day; therefore, he has to work on a very _____ schedule.",dense,various,tight,current,tight
99-GSAT-8,"Michael Phelps, an American swimmer, broke seven world records and won eight gold medals in men’s swimming _____ in the 2008 Olympics.",drills,techniques,routines,contests,contests
99-GSAT-9,"Those college students work at the orphanage on a _____ basis, helping the children with their studies without receiving any pay.",voluntary,competitive,sorrowful,realistic,voluntary
115-GSAT-1,The mayor has such a ______ schedule that it takes weeks to arrange an interview with her.,hasty,tight,diligent,routine,tight
115-GSAT-2,"Jane started as an ______ art designer, but now she has a professional studio of her own.",official,instant,amateur,elementary,amateur
115-GSAT-3,The teaching ______ at the famous high school soon attracted more than a dozen well-qualified applicants.,career,vacancy,expectation,inspiration,vacancy
115-GSAT-4,"Designed by a young engineer, the new product has created far more profit than ______ expected.",initially,genuinely,alternatively,fundamentally,initially
115-GSAT-5,It has been confirmed that a balanced ______ of fruit and vegetables is a key element to good health.,dimension,integration,provision,consumption,consumption
115-GSAT-6,"As a shy boy afraid of making public appearances, Timmy ______ the thought of speaking before large audiences.",dreads,stresses,wanders,escapes,dreads
115-GSAT-7,"To the newly-crowned winner of the piano competition, music is his life’s ______, which he has devoted himself to whole-heartedly.",resource,impact,passion,emphasis,passion
115-GSAT-8,The drunk driver who shouted at passers-by and ______ them with glass bottles was quickly arrested by the police.,shattered,assaulted,overturned,condemned,assaulted
115-GSAT-9,There were so many people at the bus station that I had to ______ my way through the crowd to board the bus in time.,crash,tumble,elbow,struggle,elbow
115-GSAT-10,Deadly shootings on US campuses have raised ______ concerns about how to prevent such tragic incidents from happening again.,swift,brutal,harsh,grave,grave