code,question,option 1,option 2,option 3,option 4,correct answer
109-GSAT-7,The students in Professor Smith’s classical Chinese class are required to _____ poems by famous Chinese poets.,construct,expose,recite,install,recite
109-GSAT-8,"Although Mr. Tang claims that the house belongs to him, he has not offered any proof of _____.",convention,relationship,insurance,ownership,ownership
109-GSAT-9,"Ancient Athens, famous for its early development of the democratic system, is often said to be the _____ of democracy.",mission,target,cradle,milestone,cradle
110-GSAT-1,Tom is really a naughty boy. He likes to _____ and play jokes on his younger sister when their parents are not around.,alert,spare,tease,oppose,tease
110-GSAT-10,The 2011 Nobel Peace Prize was awarded _____ to three women for the efforts they made in fighting for women’s rights.,actively,earnestly,jointly,naturally,jointly
110-GSAT-11,The company is _____ and making great profits under the wise leadership of the chief executive officer.,applauding,flourishing,circulating,exceeding,flourishing
110-GSAT-12,It is absolutely _____ to waste your money on an expensive car when you cannot even get a driver’s license.,absurd,cautious,vigorous,obstinate,absurd
110-GSAT-13,The problem of illegal drug use is very complex and cannot be traced to merely one _____ reason.,singular,countable,favorable,defensive,singular
110-GSAT-14,The non-profit organization has _____ $1 million over five years to finance the construction of the medical center.,equipped,resolved,committed,associated,committed
110-GSAT-15,"One week after the typhoon, some bridges were finally opened and bus service _____ in the country’s most severely damaged areas.",departed,resumed,transported,corresponded,resumed
110-GSAT-2,"Elderly shoppers in this store are advised to take the elevator rather than the _____, which may move too fast for them to keep their balance.",airway,operator,escalator,instrument,escalator
110-GSAT-3,"Upon hearing its master’s call, the dog wagged its tail, and followed her out of the room _____.",obediently,apparently,logically,thoroughly,obediently
110-GSAT-4,"Since many of our house plants are from humid jungle environments, they need _____ air to keep them green and healthy.",moist,stale,crisp,fertile,moist
110-GSAT-5,"The skydiver managed to land safely after jumping out of the aircraft, even though her _____ failed to open in midair.",glimpse,latitude,segment,parachute,parachute
110-GSAT-6,"The invention of the steam engine, which was used to power heavy machines, brought about a _____ change in society.",persuasive,harmonious,conventional,revolutionary,revolutionary
110-GSAT-7,"To encourage classroom _____, the teacher divided the class into groups and asked them to solve a problem together with their partners.",operation,interaction,adjustment,explanation,interaction
110-GSAT-8,Lisa _____ onto the ground and injured her ankle while she was playing basketball yesterday.,buried,punched,scattered,tumbled,tumbled
110-GSAT-9,Hundreds of residents received free testing _____ from the city government to find out if their water contained any harmful chemicals.,kits,trials,zones,proofs,kits
111-GSAT-1,"When Jeffery doesn’t feel like cooking, he often orders pizza online and has it ______ to his house.",advanced,delivered,offered,stretched,delivered
111-GSAT-10,"With pink cherry blossoms blooming everywhere, the valley ______ like a young bride under the bright spring sunshine.",bounces,blushes,polishes,transfers,blushes
111-GSAT-2,Jane is the best ______ I have ever had. I cannot imagine running my office without her help.,assistant,influence,contribution,politician,assistant
111-GSAT-3,"The temple celebrated Mazu Festival by hosting ten days of lion dances, Taiwanese operas, and traditional hand ______ shows.",chat,quiz,puppet,variety,puppet
111-GSAT-4,The new vaccine was banned by the Food and Drug Administration due to its _______ fatal side effects.,potentially,delicately,ambiguously,optionally,potentially
111-GSAT-5,______ the photos with dates and keywords help you sort them easily in your file.,Tagging,Flocking,Rolling,Snapping,Tagging
111-GSAT-6,"An ______ person is usually pleasant and easy to get along with, but don’t expect that he or she will always say “yes” to everything.",enormous,intimate,agreeable,ultimate,agreeable
111-GSAT-7,"Hidden deep in a small alley among various tiny shops, the entrance of the Michelin star restaurant is barely ______ to passersby.",identical,visible,available,remarkable,visible
111-GSAT-8,"The original budget for my round-island trip was NT$5,000, but the ______ cost is likely to be 50 percent higher.",moderate,absolute,promising,eventual,eventual
111-GSAT-9,"After watching a TV program on natural history, Adam decided to go on a ______ for dinosaur fossils in South Dakota.",trial,route,strike,quest,quest
112-GSAT-1,The bus driver often complains about chewing gum found under passenger seats because it is ______ and very hard to remove.,sticky,greasy,clumsy,mighty,sticky
112-GSAT-10,Studies show that the unbiased media are in fact often deeply influenced by political ideology.,undoubtedly,roughly,understandably,supposedly,supposedly
112-GSAT-2,Jesse is a talented model. He can easily adopt an elegant ______ for a camera shoot.,clap,toss,pose,snap,pose
112-GSAT-3,"In order to draw her family tree, Mary tried to trace her ______ back to their arrival in North America.",siblings,commuters,ancestors,instructors,ancestors
112-GSAT-4,"Upon the super typhoon warning, Nancy rushed to the supermarket—only to find the shelves almost ______ and the stock nearly gone.",blank,bare,hollow,queer,bare
112-GSAT-5,"Even though Jack said “Sorry!” to me in person, I did not feel any ______ in his apology.",liability,generosity,integrity,sincerity,sincerity
112-GSAT-6,My grandfather has astonishing powers of ______. He can still vividly describe his first day at school as a child.,resolve,fraction,privilege,recall,recall
112-GSAT-7,Recent research has found lots of evidence to ______ the drug company’s claims about its “miracle” tablets for curing cancer.,provoke,counter,expose,convert,counter
112-GSAT-8,Corrupt officials and misguided policies have ______ the country’s economy and burdened its people with enormous foreign debts.,crippled,accelerated,rendered,ventured,crippled
112-GSAT-9,"As a record number of fans showed up for the baseball final, the highways around the stadium were ______ with traffic all day.",choked,disturbed,enclosed,injected,choked
113-GSAT-1,People who desire a ______ figure should exercise regularly and maintain healthy eating habits.,spicy,slender,slight,slippery,slender
113-GSAT-10,"David felt disappointed when he found out that he could not choose his study partners, but would be ______ placed in a study group.",eligibly,randomly,apparently,consequently,randomly
113-GSAT-2,Watching the sun ______ from a sea of clouds is a must-do activity for all visitors to Ali Mountain.,emerging,flashing,rushing,floating,emerging
113-GSAT-3,Do you know what time the next bus is ______? I’ve been waiting here for more than 30 minutes.,apt,due,bound,docked,due
113-GSAT-4,"The roasting heat and high ______ made me feel hot and sticky, no matter what I did to cool off.",density,humidity,circulation,atmosphere,humidity
113-GSAT-5,Artwork created by truly great artists such as Picasso and Monet will no doubt ______ the test of time.,stay,take,serve,stand,stand
113-GSAT-6,"In some countries, military service is ______ for men only; women do not have to serve in the military.",forceful,realistic,compulsory,distinctive,compulsory
113-GSAT-7,The team complained that its leader always took the ______ for all the hard work done by the team members.,advantage,revenge,remedy,credit,credit
113-GSAT-8,"Located at the center of the city, the business hotel ______ not only good service but also convenient public transport.",proposes,contains,promises,confirms,promises
113-GSAT-9,"As blood supplies have fallen to a critically low level, many hospitals are making an ______ for the public to donate blood.",appeal,approach,operation,observation,appeal
114-GSAT-1,"If you put a ______ under a leaking faucet, you will be surprised at the amount of water collected in 24 hours.",border,timer,container,marker,container
114-GSAT-10,"The manager of the company was sued for ______ abusing his colleagues, calling them “hopeless losers.”",verbally,dominantly,legitimately,relevantly,verbally
114-GSAT-2,The local farmers’ market is popular as it offers a variety of fresh seasonal ______ to people in the community.,produce,fashion,brand,trend,produce
114-GSAT-3,"As the years have passed by, many of my childhood memories are already _____; I can no longer recall clearly what happened back then.",blurring,trimming,draining,glaring,blurring
114-GSAT-4,"Racist remarks are by nature ______ and hurtful, and should be avoided on all occasions.",excessive,furious,offensive,stubborn,offensive
114-GSAT-5,"Not satisfied with the first ______ of her essay, Mary revised it several times before turning it in to the teacher.",text,brush,draft,plot,draft
114-GSAT-6,"Left ______ for years, the deserted house was filled with a thick coating of dust and a smell of old damp wood.",casual,fragile,remote,vacant,vacant
114-GSAT-7,The high school student showed ______ courage when she helped the old man escape from the fire.,gigantic,exclusive,multiple,enormous,enormous
114-GSAT-8,Publicly financed projects are often ______ or delayed during tough economic times due to a lack of resources.,halted,hatched,possessed,reinforced,halted
114-GSAT-9,"Despite his busy schedule, the President ______ the school’s graduation ceremony with his presence and a heartwarming speech.",praised,graced,addressed,credited,graced
93-GSAT-1,I called the airline to ______ my flight reservation a week before I left for Canada.,expand,attach,confirm,strengthen,confirm
93-GSAT-10,Jane usually buys things on ______. Her purchases seem to be driven by some sudden force or desire.,accident,compliment,justification,impulse,impulse
93-GSAT-11,The week-long rainfall has ______ landslides and flooding in the mountain areas.,set about,brought about,come about,put about,brought about
93-GSAT-12,"In the cross-lake swimming race, a boat will be ______ in case of an emergency.",standing by,turning on,getting on,running down,standing by
93-GSAT-13,The ground is slippery. Hold onto the rope and don’t ______.,put off,turn up,let go,take apart,let go
93-GSAT-14,"______ the weather, the athletic meetings will be held on time.",Instead of,In relation to,On behalf of,Regardless of,Regardless of
93-GSAT-15,"If people keep polluting the rivers, no fish there will survive ______.",at all cost,for a long while,in the long run,by no means,in the long run
93-GSAT-2,"In order to write a report on stars, we decided to ______ the stars in the sky every night.",design,seize,quote,observe,observe
93-GSAT-3,Julie wants to buy a ______ computer so that she can carry it around when she travels.,memorable,portable,predictable,readable,portable
93-GSAT-4,My grandmother likes to surprise people. She never calls ______ to inform us of her visits.,beforehand,anyhow,originally,consequently,beforehand
93-GSAT-5,"As the tallest building in the world, Taipei 101 has become a new ______ of Taipei City.",incident,geography,skylight,landmark,landmark
93-GSAT-6,Many scholars and experts from all over the world will be invited to attend this yearly ______ on drug control.,reference,intention,conference,interaction,conference
93-GSAT-7,"John had failed to pay his phone bills for months, so his telephone was ______ last week.",interrupted,disconnected,excluded,discriminated,disconnected
93-GSAT-8,"The organic food products are made of natural ingredients, with no ______ flavors added.",accurate,regular,superficial,artificial,artificial
93-GSAT-9,Jessica is a very religious girl; she believes that she is always ______ supported by her god.,spiritually,typically,historically,officially,spiritually
94-GSAT-1,"As computers are getting less expensive, they are _____ used in schools and offices today.",widely,expectedly,consciously,influentially,widely
94-GSAT-10,The drug dealer was ________ by the police while he was selling cocaine to a high school student.,threatened,endangered,demonstrated,arrested,arrested
94-GSAT-11,The rise of oil prices made scientists search for new energy resources to _____ oil.,apply,replace,inform,persuade,replace
94-GSAT-12,"Without much contact with the outside world for many years, John found many technological invention _____ to him.",natural,common,foreign,objective,foreign
94-GSAT-13,The medicine you take for a cold may cause _____; try not to drive after you take it.,incident,violence,bacteria,drowsiness,drowsiness
94-GSAT-14,"To gain more ______, some legislators would get into violent physical fights so that they may appear in TV news reports.",publicity,reputation,significance,communication,publicity
94-GSAT-15,"To live an efficient life, we have to arrange the things to do in order of _____ and start with the most important ones.",authority,priority,regularity,security,priority
94-GSAT-2,Mr. Chang always tries to answer all questions from his students. He will not _____ any of them even if they may sound stupid.,reform,depress,ignore,confirm,ignore
94-GSAT-3,Irene does not throw away used envelopes. She _____ them by using them for taking telephone messages.,designs,recycles,disguises,manufactures,recycles
94-GSAT-4,"Cheese, powdered milk, and yogurt are common milk _____.",produces,products,productions,productivities,products
94-GSAT-5,"Although he is a chef, Roberto _____ cooks his own meals.",rarely,bitterly,naturally,skillfully,rarely
94-GSAT-6,"Due to the yearly bonus system, the 100 ________ positions in this high-tech company have attracted many applicants from around the island.",loyal,evident,typical,vacant,vacant
94-GSAT-7,"If you want to borrow magazines, tapes, or CDs, you can visit the library. They are all ______ there.",sufficient,marvelous,impressive,available,available
94-GSAT-8,The fire in the fireworks factory in Changhua set off a series of powerful _________ and killed four people.,explosions,extensions,inspections,impressions,explosions
94-GSAT-9,A good government official has to ________ the temptation of money and make the right decision.,consist,insist,resist,persist,resist
95-GSAT-1,"If we can _____ to, we will take a vacation abroad in the summer.",pay,move,expose,afford,afford
95-GSAT-10,Jerry didn’t _____ his primary school classmate Mary until he listened to her self-introduction.,acquaint,acquire,recognize,realize,recognize
95-GSAT-11,"With the completion of several public _____ projects, such as the MRT, commuting to work has become easier for people living in the suburbs.",transportation,traffic,travel,transfer,transportation
95-GSAT-12,"With a good _____ of both Chinese and English, Miss Lin was assigned the task of oral interpretation for the visiting American delegation.",writing,program,command,impression,command
95-GSAT-13,I am studying so hard for the forthcoming entrance exam that I do not have the_____ of a free weekend to rest.,luxury,license,limitation,strength,luxury
95-GSAT-14,Kim was completely _____ after jogging in the hot sun all afternoon; she had little energy left.,kicked out,handed out,worn out,put out,worn out
95-GSAT-15,"When Jason failed to pay his bill, the network company_______ his Internet connection.",cut off,cut back,cut short,cut down,cut off
95-GSAT-2,A _____ mistake found in parenthood is that parents often set unrealistic goals for their children.,terrific,common,straight,favorable,common
95-GSAT-3,"Some words, such as “sandwich” and “hamburger,” were _____ the names of people or even towns.",originally,ideally,relatively,sincerely,originally
95-GSAT-4,Have you ever _____ how the ancient Egyptians created such marvelous feats of engineering as the pyramids?,concluded,wondered,admitted,persuaded,wondered
95-GSAT-5,Mr. Johnson was disappointed at his students for having a passive learning _____.,result,progress,attitude,energy,attitude
95-GSAT-6,Anne dreaded giving a speech before three hundred people; even thinking about it made her _____.,passionate,anxious,ambitious,optimistic,anxious
95-GSAT-7,I had to _____ Jack’s invitation to the party because it conflicted with an important business meeting.,decline,depart,devote,deserve,decline
95-GSAT-8,"Selling fried chicken at the night market doesn’t seem to be a decent business, but it is actually quite _____.",plentiful,precious,profitable,productive,profitable
95-GSAT-9,"The passengers _____ escaped death when a bomb exploded in the subway station, killing sixty people.",traditionally,valuably,loosely,narrowly,narrowly
96-GSAT-1,The movie director adapted this year’s bestseller into a hit and made a _____.,fortune,request,companion,decision,fortune
96-GSAT-10,It’s a pity that you have to leave so soon. I _____ hope that you will come back very soon.,sincerely,scarcely,reliably,obviously,sincerely
96-GSAT-11,"We human beings may live without clothes, but food and air are _____ to our life.",magnificent,essential,influential,profitable,essential
96-GSAT-12,The manager _____ without hesitation after he had been offered a better job in another company.,retreated,revived,removed,resigned,resigned
96-GSAT-13,Many important legal _____ concerning the tragic incident have now been preserved in the museum.,distributions,formations,documents,constructions,documents
96-GSAT-14,"I’m not sure exactly how much scholarship you’ll receive, but it will _____ cover your major expenses.",recently,roughly,frankly,variously,roughly
96-GSAT-15,"Tom was very ill a week ago, but now he looks healthy. We are _____ by his quick recovery.",amazed,convinced,advised,confirmed,amazed
96-GSAT-2,"Wang Chien-ming, the Yankees’ best pitcher last year, already showed his great _____ for baseball when he was still a teenager.",response,reluctance,permission,potential,potential
96-GSAT-3,"Although Jeffery had to keep two part-time jobs to support his family, he never _____ his studies. In fact, he graduated with honors.",neglected,segmented,financed,diminished,neglected
96-GSAT-4,"If it is too cold in this room, you can _____ the air conditioner to make yourself feel comfortable.",fasten,adjust,defeat,upload,adjust
96-GSAT-5,This course will provide students with a solid _____ for research. It is highly recommended for those who plan to go to graduate school.,admission,circulation,foundation,extension,foundation
96-GSAT-6,Peter is now living on a _____ of NT$100 per day. He cannot afford any recreational activities.,division,guidance,measure,budget,budget
96-GSAT-7,Amy succeeded in _____ for a raise though her boss didn’t agree to increase her salary at first.,compensating,negotiating,substituting,advertising,negotiating
96-GSAT-8,Ms. Li’s business _____ very quickly. She opened her first store two years ago; now she has fifty stores all over the country.,discouraged,transferred,stretched,expanded,expanded
96-GSAT-9,Ruth is a very _____ person. She cannot take any criticism and always finds excuses to justify herself.,shameful,innocent,defensive,outgoing,defensive
97-GSAT-1,Amy did not _____ changes in the course schedule and therefore missed the class.,arrest,alarm,notice,delay,notice
97-GSAT-10,"Simon loves his work. To him, work always comes first, and family and friends are _____.",secondary,temporary,sociable,capable,secondary
97-GSAT-11,"Although your plans look good, you have to be _____ and consider what you can actually do.",dramatic,realistic,stressful,manageable,realistic
97-GSAT-12,"Built under the sea in 1994, the _____ between England and France connects the UK more closely with mainland Europe.",waterfall,temple,tunnel,channel,tunnel
97-GSAT-13,"This tour package is very appealing, and that one looks _____ attractive. I don’t know which one to choose.",equally,annually,merely,gratefully,equally
97-GSAT-14,"Hseu Fang-yi, a young Taiwanese dancer, recently _____ at Lincoln Center in New York and won a great deal of praise.",performed,pretended,postponed,persuaded,performed
97-GSAT-15,The police searched the house of the suspect _____. They almost turned the whole house upside down.,relatively,thoroughly,casually,permanently,thoroughly
97-GSAT-2,"It is not easy for old people to _____ their backs, so they need help when their backs itch.",label,scratch,lighten,squeeze,scratch
97-GSAT-3,Mary is suffering from a stomachache and needs to eat food which is easy to _____.,launch,invade,adopt,digest,digest
97-GSAT-4,"Since our classroom is not air-conditioned, we have to _____ the heat during the hot summer days.",consume,tolerate,recover,promote,tolerate
97-GSAT-5,Sue is so _____ that she always breaks something when she is shopping at a store.,religious,visual,clumsy,intimate,clumsy
97-GSAT-6,Ann enjoyed going to the flower market. She believed that the _____ of flowers refreshed her mind.,instance,dominance,appliance,fragrance,fragrance
97-GSAT-7,The profits of Prince Charles’s organic farm go to _____ to help the poor and the sick.,charities,bulletins,harvests,rebels,charities
97-GSAT-8,"Jack was given the rare _____ of using the president’s office, which made others quite jealous.",mischief,privilege,involvement,occupation,privilege
97-GSAT-9,This new computer is obviously _____ to the old one because it has many new functions.,technical,suitable,superior,typical,superior
98-GSAT-1,Steve’s description of the place was so _____ that I could almost picture it in my mind.,bitter,vivid,sensitive,courageous,vivid
98-GSAT-10,"With the worsening of global economic conditions, it seems wiser and more _____ to keep cash in the bank rather than to invest in the stock market.",sensible,portable,explicit,anxious,sensible
98-GSAT-11,"Under the _____ of newly elected president Barack Obama, the US is expected to turn a new page in politics and economy.",adoption,fragrance,identity,leadership,leadership
98-GSAT-12,Rapid advancement in motor engineering makes it _____ possible to build a flying car in the near future.,individually,narrowly,punctually,technically,technically
98-GSAT-13,"When you take photos, you can move around to shoot the target object from different _____.",moods,trends,angles,inputs,angles
98-GSAT-14,Students were asked to _____ or rewrite their compositions based on the teacher’s comments.,revise,resign,refresh,remind,revise
98-GSAT-15,"Besides lung cancer, another _____ of smoking is wrinkles, a premature sign of aging.",blessing,campaign,consequence,breakthrough,consequence
98-GSAT-2,"When people feel uncomfortable or nervous, they may _____ their arms across their chests as if to protect themselves.",toss,fold,veil,yield,fold
98-GSAT-3,The doors of these department stores slide open _____ when you approach them. You don’t have to open them yourself.,necessarily,diligently,automatically,intentionally,automatically
98-GSAT-4,"Nicole is a _____ language learner. Within a short period of time, she has developed a good command of Chinese and Japanese.",convenient,popular,regular,brilliant,brilliant
98-GSAT-5,"With rising oil prices, there is an increasing _____ for people to ride bicycles to work.",permit,instrument,appearance,tendency,tendency
98-GSAT-6,"This information came from a very _____ source, so you don’t have to worry about being cheated.",reliable,flexible,clumsy,brutal,reliable
98-GSAT-7,We hope that there will be no war in the world and that all people live in peace and _____ with each other.,complaint,harmony,mission,texture,harmony
98-GSAT-8,"To have a full discussion of the issue, the committee spent a whole hour _____ their ideas at the meeting.",depositing,exchanging,governing,interrupting,exchanging
98-GSAT-9,"While adapting to western ways of living, many Asian immigrants in the US still try hard to _____ their own cultures and traditions.",volunteer,scatter,preserve,motivate,preserve
99-GSAT-1,Mr. Lin is a very ________ writer; he publishes at least five novels every year.,moderate,temporary,productive,reluctant,productive
99-GSAT-10,"Studies show that asking children to do house _____, such as taking out the trash or doing the dishes, helps them grow into responsible adults.",missions,chores,approaches,incidents,chores
99-GSAT-11,"John has been scolded by his boss for over ten minutes now. _____, she is not happy about his being late again.",Expressively,Apparently,Immediately,Originally,Apparently
99-GSAT-12,"Since the orange trees suffered _____ damage from a storm in the summer, the farmers are expecting a sharp decline in harvests this winter.",potential,relative,severe,mutual,severe
99-GSAT-13,"Typhoon Morakot claimed more than six hundred lives in early August of 2009, making it the most serious natural _____ in Taiwan in recent decades.",disaster,barrier,anxiety,collapse,disaster
99-GSAT-14,Robert was the only _____ to the car accident. The police had to count on him to find out exactly how the accident happened.,dealer,guide,witness,client,witness
99-GSAT-15,"Badly injured in the car accident, Jason could _____ move his legs and was sent to the hospital right away.",accordingly,undoubtedly,handily,scarcely,scarcely
99-GSAT-2,Mr. Lin is a very ______ writer; he publishes at least five novels every year.,moderate,temporary,productive,reluctant,productive
99-GSAT-3,Using a heating pad or taking warm baths can sometimes help to _____ pain in the lower back.,polish,relieve,switch,maintain,relieve
99-GSAT-4,"Due to ______, prices for daily necessities have gone up and we have to pay more for the same items now.",inflation,solution,objection,condition,inflation
